"Nom";"Nom latin";" Description";"natif de";"type";"Genus";"famille";"couleur de feuille";"usage commun";"éclose";"arbre ou plante"
"Pin de Wollemi";"Wollemia nobilis";"Arbre à feuilles persistantes, conifère, atteignant 25-40 m de haut, souvent à plusieurs tiges. Écorce brun foncé et noueuse. Feuilles linéaires, plates, 3–8 cm de long et 2–5 mm de large. Les cônes femelles (graines) sont verts, mesurent 6–12 cm de long et 5–10 cm de diamètre, et mûrissent environ 18–20 mois après la pollinisation. À maturité, ils se désintègrent pour libérer les graines. Les cônes mâles (polliniques) sont de forme conique élancée, de 5 à 11 cm de long et de 1 à 2 cm de large.";"Australie";"conifère";"Wollemia ";"Araucariaceae";"vert";"jardin";"pas de fleur";"un arbre"
"Séneçon en arbre";"Baccharis pilularis";"Arbuste à feuilles persistantes, feuilles larges, formant un tapis, à environ 0,6 m de haut pour une largeur de 1,8 m. Tiges rainurées et résineuses. Feuilles simples, alternes, oblongues-lancéolées à obovales, de 1 à 5 cm de long, vert foncé à vert jaune dessus, plus pâles dessous. Fleurs dioïques - mâles et femelles sur des plantes séparées, en grappes serrées de capitules, fleurs mâles jaunâtres, fleurs femelles blanches.";"USA";"Feuillu";"Baccharis ";"Asteraceae";"vert foncé";"la nature";"automne";"une plante"
"Arbre à fleurs d'orchidées";"Bauhinia variegata";"Un arbuste ou un arbre à feuilles larges semi-persistantes à caduques, le plus souvent observé comme un arbuste à tiges multiples et à grande diffusion, peut être jalonné de sorte qu'il se développe en un arbre attrayant d'environ 7,5 m de haut et de largeur similaire. Feuilles simples, alternes, jusqu'à 20 cm, bilobées vert clair. Fleurs en grappes terminales, peu nombreuses par grappe, elles apparaissent à ou après la chute des feuilles, chaque fleur ressemblant à une orchidée mesure environ 5 à 8 cm de large et possède 5 pétales inégaux, rose clair à violet pâle, parfois blancs, 5 étamines évidentes. Le fruit est une gousse aplatie et ligneuse de 30 cm de long et 2,5 cm de large.";"Inde et Chine";"Feuillu";"Bauhinia ";"Fabaceae";"vert";"jardin";"hiver";"un arbre"
"Epine vinette à feuilles de buis nain";"Berberis buxifolia 'Nana'";"Arbuste à feuilles persistantes, feuilles larges, à croissance lente, 0,5 m de haut, dense, port montagneux, petites épines, tripartites ou simples. Feuilles simples, alternes, de 1 à 2,5 cm de long. Fleurs jaune-orange. Fruit bleu violet.";"Chili et Argentine";"Feuillu";"Berberis ";"Berberidacae";"vert";"jardin";"printemps";"une plante"
"Bouleau de Chine";"Betula albo-sinensis";"Arbre caduque, 12-18 (24) m, port arrondi. Feuilles alternes, simples, ovales à ovales-oblongues, de 5 à 7,5 cm de long, d'environ 3 cm de large, vert foncé au-dessus, pétiole de 7 à 20 mm de long; feuillage jaune à l'automne. Écorce riche rouge orangé ou brun orangé, se décolle en feuilles très fines, sous couche recouverte d'une fleur blanche.";"Chine";"Feuillu";"Betula ";"Betulaceae";"vert foncé";"jardin";"pas de fleur";"un arbre"
"Séneçon gris";"Brachyglottis greyi";"Arbuste à feuilles persistantes, feuilles larges, mesurant 1,2 à 1,5 m de haut et 1,8 m de large, tiges raides et légèrement incurvées. Feuilles alternes, simples, oblongues à ovales-oblongues, de 4 à 8 cm de long et 2,5 à 4 cm de large, vertes sur le dessus, blanches laineuses en dessous.";"Nouvelle Zélande";"Feuillu";"Brachyglottis ";"Asteraceae";"vert";"jardin";"printemps";"une plante"
"Arbre aux papillons à feuilles alternes";"Buddleia alternifolia";"Grand arbuste ou petit arbre à feuilles caduques à feuilles larges, pouvant atteindre 9 m de haut, mais généralement moins, tiges minces, longues, arquées / pendantes. Feuilles simples, alternes, lancéolées, de 1 à 7 cm de long (plus petites sur les branches florales), extrémité pointue (acuminée), base cunéiforme, marge entière, vert foncé à vert argenté, gris tomenteux en dessous. Fleurs petites, de couleur lilas, portées en grappes presque cylindriques, d'environ 5 × 3 cm. Fleurit au début de l'été.";"Chine";"Feuillu";"Buddleia ";"Scrophulariaceae";"vert foncé";"rue";"été";"une plante"
"Buis commun";"Buxus sempervirens";"Arbuste à feuilles persistantes à feuilles larges, 4,5-6 (9) m de haut, dense, multibranche, arrondi ou large. Feuilles opposées, simples, elliptiques à oblongues, de 12 à 25 mm de long, environ la moitié de la largeur, vert foncé dessus, vert clair ou jaunâtre en dessous. Les fleurs crémeuses, sans pétales, se développent à l'aisselle des feuilles au printemps. Fruit globuleux, capsule de 8 mm de long, à trois cornes, déhiscente.";"Europe";"Feuillu";"Buxus ";"Buxaceae";"vert foncé";"rue, jardin";"printemps";"une plante"
"Buis Collectionnée";"Buxus bodinieri";"Arbuste à feuilles persistantes, feuilles larges, mesurant environ 4-5 m de haut, nombreuses tiges fines et flexibles dressées. Feuilles opposées, simples, limbe généralement de forme spatulée, peuvent être étroitement ovales ou obovales, de 2 à 4 cm de long et de 0,8 à 1,8 cm de large, vertes et brillantes. Fleurs (mâles et femelles) en petites grappes axillaires au printemps. Fruit de 5 mm de long.";"Chine";"Feuillu";"Buxus ";"Buxaceae";"vert";"jardin";"printemps";"une plante"